{
  "module": "signs",
  "title": "Road Signs",
  "description": "Recognize signs by shape, color, and meaning.",
  "_note": "Sign questions use pool:\"signs\" — the engine shows the correct sign plus a fresh random set of distractor signs each time. 'exclude' drops look-alikes so the question always has exactly one right answer.",
  "scenarios": [
    {
      "id": "sign-stop",
      "concept": "Stop sign",
      "manualRef": "Traffic Signs",
      "interaction": "choose-one",
      "prompt": "Tap the sign that means STOP.",
      "scene": { "template": "row", "pool": "signs", "show": 3, "items": [
        { "id": "a", "type": "sign", "name": "stop", "correct": true }
      ] },
      "feedback": {
        "correct": "That's the stop sign — eight sides and red. Come to a full stop.",
        "default": "The stop sign is red with eight sides. Try again."
      },
      "hint": "a"
    },
    {
      "id": "sign-yield",
      "concept": "Yield sign",
      "manualRef": "Traffic Signs",
      "interaction": "choose-one",
      "prompt": "Tap the sign that means YIELD (let others go first).",
      "scene": { "template": "row", "pool": "signs", "show": 3, "items": [
        { "id": "b", "type": "sign", "name": "yield", "correct": true }
      ] },
      "feedback": {
        "correct": "Right — the upside-down red and white triangle means yield: let others go, then go when clear.",
        "default": "Yield is the downward red-and-white triangle. Try again."
      },
      "hint": "b"
    },
    {
      "id": "sign-do-not-enter",
      "concept": "Do Not Enter",
      "manualRef": "Traffic Signs",
      "interaction": "choose-one",
      "prompt": "Tap the sign that means DO NOT ENTER.",
      "scene": { "template": "row", "pool": "signs", "show": 3, "items": [
        { "id": "a", "type": "sign", "name": "doNotEnter", "correct": true }
      ] },
      "feedback": {
        "correct": "Yes — the red circle with a white bar means do not enter. Don't drive in.",
        "default": "Do Not Enter is the red circle with a white bar. Try again."
      },
      "hint": "a"
    },
    {
      "id": "sign-warning-shape",
      "concept": "Warning signs are yellow diamonds",
      "manualRef": "Traffic Signs",
      "interaction": "choose-one",
      "prompt": "Warning signs are yellow diamonds. Tap the warning sign.",
      "scene": { "template": "row", "pool": "signs", "show": 3, "exclude": ["merge", "pedestrianXing", "workZone", "pennant"], "items": [
        { "id": "b", "type": "sign", "name": "curve", "correct": true }
      ] },
      "feedback": {
        "correct": "Yes! Yellow diamond signs warn you about what's ahead — here, a curve.",
        "default": "Warning signs are yellow and diamond-shaped. Try again."
      },
      "hint": "b"
    },
    {
      "id": "sign-railroad",
      "concept": "Railroad crossing",
      "manualRef": "Railroad Crossings",
      "interaction": "choose-one",
      "prompt": "Tap the sign that warns of a railroad crossing.",
      "scene": { "template": "row", "pool": "signs", "show": 3, "items": [
        { "id": "b", "type": "sign", "name": "railroad", "correct": true }
      ] },
      "feedback": {
        "correct": "Yes — the round yellow sign with the X and two R's means a railroad crossing is ahead.",
        "default": "The railroad sign is round, yellow, with an X and two R's. Try again."
      },
      "hint": "b"
    },
    {
      "id": "sign-pedestrian",
      "concept": "Pedestrian crossing",
      "manualRef": "Traffic Signs",
      "interaction": "choose-one",
      "prompt": "Tap the sign that warns people may be crossing.",
      "scene": { "template": "row", "pool": "signs", "show": 3, "exclude": ["school"], "items": [
        { "id": "a", "type": "sign", "name": "pedestrianXing", "correct": true }
      ] },
      "feedback": {
        "correct": "Yes — the yellow diamond with a person means watch for people crossing.",
        "default": "Look for the yellow sign with a walking person. Try again."
      },
      "hint": "a"
    },
    {
      "id": "sign-school",
      "concept": "School zone",
      "manualRef": "Traffic Signs",
      "interaction": "choose-one",
      "prompt": "Tap the sign that means you are near a school.",
      "scene": { "template": "row", "pool": "signs", "show": 3, "exclude": ["pedestrianXing"], "items": [
        { "id": "b", "type": "sign", "name": "school", "correct": true }
      ] },
      "feedback": {
        "correct": "Yes — the yellow-green five-sided sign with children means a school zone. Slow down and watch for kids.",
        "default": "The school sign has five sides and shows children. Try again."
      },
      "hint": "b"
    },
    {
      "id": "sign-work-zone",
      "concept": "Road work (orange)",
      "manualRef": "Work Zones",
      "interaction": "choose-one",
      "prompt": "Orange signs mean road work. Tap the road-work sign.",
      "scene": { "template": "row", "pool": "signs", "show": 3, "items": [
        { "id": "b", "type": "sign", "name": "workZone", "correct": true }
      ] },
      "feedback": {
        "correct": "Yes — orange means a work zone. Slow down and watch for workers.",
        "default": "Road-work signs are orange. Try again."
      },
      "hint": "b"
    },
    {
      "id": "sign-no-left",
      "concept": "No left turn",
      "manualRef": "Traffic Signs",
      "interaction": "choose-one",
      "prompt": "Tap the sign that means NO LEFT TURN.",
      "scene": { "template": "row", "pool": "signs", "show": 3, "items": [
        { "id": "b", "type": "sign", "name": "noLeftTurn", "correct": true }
      ] },
      "feedback": {
        "correct": "Yes — the left arrow with a red slash means you can't turn left here.",
        "default": "Look for the left arrow crossed out. Try again."
      },
      "hint": "b"
    },
    {
      "id": "sign-speed-limit",
      "concept": "Speed limit",
      "manualRef": "Speed Limits",
      "interaction": "choose-one",
      "prompt": "Tap the sign that shows the speed limit.",
      "scene": { "template": "row", "pool": "signs", "show": 3, "items": [
        { "id": "a", "type": "sign", "name": "speedLimit", "arg": 55, "correct": true }
      ] },
      "feedback": {
        "correct": "Yes — the white sign with a number is the speed limit. Don't drive faster than that.",
        "default": "The speed limit is the white rectangle with a number. Try again."
      },
      "hint": "a"
    },
    {
      "id": "sign-guide",
      "concept": "Guide signs are green",
      "manualRef": "Traffic Signs",
      "interaction": "choose-one",
      "prompt": "Green signs give directions and distances. Tap the green guide sign.",
      "scene": { "template": "row", "pool": "signs", "show": 3, "items": [
        { "id": "a", "type": "sign", "name": "guideSign", "correct": true }
      ] },
      "feedback": {
        "correct": "Yes — green signs guide you. They show directions, exits, and how far away places are.",
        "default": "Guide signs are green and show directions or distances. Try again."
      },
      "hint": "a"
    },
    {
      "id": "sign-service",
      "concept": "Service signs are blue",
      "manualRef": "Traffic Signs",
      "interaction": "choose-one",
      "prompt": "Blue signs point to services like hospitals, gas, and food. Tap the blue service sign.",
      "scene": { "template": "row", "pool": "signs", "show": 3, "items": [
        { "id": "a", "type": "sign", "name": "serviceSign", "correct": true }
      ] },
      "feedback": {
        "correct": "Yes — blue signs show services for drivers, like hospitals, gas, food, and rest areas.",
        "default": "Service signs are blue. Try again."
      },
      "hint": "a"
    },
    {
      "id": "sign-no-passing",
      "concept": "No passing zone pennant",
      "manualRef": "Traffic Signs",
      "interaction": "choose-one",
      "prompt": "Tap the sign that means NO PASSING ZONE.",
      "scene": { "template": "row", "pool": "signs", "show": 3, "items": [
        { "id": "a", "type": "sign", "name": "pennant", "correct": true }
      ] },
      "feedback": {
        "correct": "Yes — the yellow three-sided sign that points right means no passing zone. Don't pass other cars here.",
        "default": "The no-passing sign is a yellow pennant — a sideways triangle on the left side of the road. Try again."
      },
      "hint": "a"
    }
  ]
}
