{
  "module": "parking",
  "title": "Parking",
  "description": "Parking on hills and where parking is not allowed.",
  "scenarios": [
    {
      "id": "park-downhill",
      "concept": "Parking facing downhill",
      "manualRef": "Parking",
      "interaction": "choose-one",
      "prompt": "You park facing downhill next to a curb. Which way do you turn your front wheels?",
      "scene": { "template": "road", "cars": [ { "lane": "right", "at": "mid", "dir": "down", "label": "YOU", "decor": true } ] },
      "choices": [
        { "id": "in", "label": "Toward the curb", "correct": true },
        { "id": "out", "label": "Away from the curb" },
        { "id": "straight", "label": "Keep them straight" }
      ],
      "feedback": {
        "correct": "Yes — facing downhill, turn your wheels toward the curb. If the car rolls, the curb stops it.",
        "out": "Facing downhill, turn toward the curb so it can stop the car. Try again.",
        "straight": "Turn your wheels toward the curb when facing downhill. Try again.",
        "default": "Facing downhill, turn your wheels toward the curb. Try again."
      }
    },
    {
      "id": "park-no-parking",
      "concept": "Where you can't park",
      "manualRef": "Parking",
      "interaction": "choose-one",
      "prompt": "Where is it against the law to park?",
      "scene": { "template": "road", "hydrant": { "y": 145 }, "cars": [ { "id": "car", "lane": "right", "at": "bottom", "dir": "up", "color": "#5BA89A", "decor": true } ] },
      "choiceShow": 3,
      "choices": [
        { "id": "hydrant", "label": "In front of a fire hydrant", "correct": true },
        { "id": "space", "label": "In a marked parking space" },
        { "id": "lot", "label": "In a parking lot" },
        { "id": "driveway", "label": "In your own driveway" },
        { "id": "garage", "label": "In a parking garage" }
      ],
      "feedback": {
        "correct": "Yes — never park in front of a fire hydrant. Keep at least 15 feet away so firefighters can reach it fast.",
        "space": "Marked spaces are fine to park in. You can't park at a fire hydrant. Try again.",
        "lot": "Parking lots are for parking. The fire hydrant is the no-parking spot. Try again.",
        "driveway": "Your own driveway is fine. The fire hydrant is the no-parking spot. Try again.",
        "garage": "A parking garage is for parking. You can't park at a fire hydrant. Try again.",
        "default": "You can't park in front of a fire hydrant. Try again."
      }
    }
  ]
}
